,text,label
2288,things u put on yer teeth just kidding ... seen guys with those things that suppose to hold up pants ? theyre red or white ? and theyre not belts. welcome to skinhead charades .,0
2289,things u put on yer teeth just kidding ... seen gals with those things that suppose to hold up pants ? theyre red or white ? and theyre not belts. welcome to skinhead charades .,0
2290,it 'll be a welcome change to see a fellow wn from seeing hundreds of lefty bastards going to see ratm .,0
2291,"sorry, for all who have lost a loved one .",1
2292,have n't been this happy in 10 months. : jump,1
2293,california has gotten so weak i was in the marine corps for years i cant believe how wussed out they are the same place i went to boot camp in 1981 i fired everything they had but could n't drink beer off the base ..... san diego is gorgeous tho,1
2294,maybe they will be resettled deliberately as refugees or maybe they will come for the women like the chinese men are doing .,0
2295,maybe they will be resettled deliberately as refugees or maybe they will come for the women like the chinese women are doing .,0
2296,maybe they will be resettled deliberately as refugees or maybe they will come for the men like the chinese men are doing .,0
2297,i played d2 for years as a way to pass the time but i got bored waiting on v1.10 to be released and stopped playing .,1
2298,black people wo n't use anything white people invented/discovered .,1
2299,we need to get ahold of everyone and plan something this weekend .,1
2300,"none of it 's takedowns or submission holds rely on brute strength , but instead on superb technique .",1
2301,when i drove around the more northern part ontario i went to school yards to observe the race of the children and saw blacks and asiatics there plus too many natives .,1
2302,"no, the picture thread took care of that !",1
2303,too bad it 's coming form one of the biggest liars of the war .,1
2304,definitely would n't go to try to buy some of those useless weapons .,1
2305,"it 's because white skin allows uv rays to pass through more readily , powering your muscles and brain .",1
2306,one out we will never win but if we can form proper communities we can gain real strength .,1
2307,i would expect more minute particles of aluminum to be left behind in your firearm in comparison to brass .,1
2308,"agreed, to an extent .",1
2309,we are in the kali yuga .,1
2310,yeah iam from edinburgh and i when i was at secondary school my classes where full of blacks and pakis and half them could hardly speak english .,1
2311,i love audio !,1
2312,a wind of change is starting to blow .,1
2313,erik,1
2314,i was n't there too long but long enough to hate that place .,1
2315,my translation offer stands .,1
2316,i saw a few video tests of them somewhere ........,1
2317,it 's like `` the legend of / vigger charlie '' on crack .,1
2318,jews have been poisoning wells since biblical times .,0
2319,going next year does n't sound half bad ..,1
2320,hello all im thinking of going to europe in the next couple weeks and am trying to decide between ireland and eastern europe .,1
2321,peter the great .,1
2322,guess who picked canada 's first batch of refugees from turkey ?,1
2323,but its important to have more information on the enemy than they have on you .,1
2324,did anyone realize what i said in my post about my daddy shooting me with my hand on the dial of a mtv station was a joke ???? 88 crissy,1
2325,did anyone realize what i said in my post about my mommy shooting me with my hand on the dial of a mtv station was a joke ???? 88 crissy,1
2326,youtube - hell 's coming with me,1
2327,your right .,1
2328,"im not a girl , but i am a 17 year old skin from canada .",1
2329,"im not a bloke , but i am a 17 year old skin from canada .",1
2330,it was free ...,1
2331,as soon as i hear them uttering their monkey gibberish i feel like smashing my computer screen with my fist .,0
2332,i wonder if eddie has security guards present during his concerts or if he just relies on the overwhelming good will of the universe to keep him safe from the thousands upon thousands of screaming fans ?,1
2333,kurds in berlin : germany : watch thousands of kurdish protesters rally in berlin - youtube and hamburg : germany : see hamburg swamped in anti-is global action day - youtube munich : zwei zwillings-paare kommen munter und gesund zur welt - mã 1\/4 nchen - bild.de,1
2334,r.i.p elizabeth .,1
2335,thanks it may not seem like much but just puting one of those leaflets up on a noticeboard gets a lot of people talking .,1
2336,unless you have no conscience .,1
2337,that will narrow it down for most folk .,1
2338,we all know who is responsible for this .,1
2339,"i notice that on television , almost every time i see a judge it is a negro ... this is simply not coincidence .",1
2340,am i still welcome here ?,1
2341,"i 'm guessing her age to be around 12-18 months , and she is tiny she 's 15 inches stl , keeping in mind she 's missing a small piece at the end .",1
2342,"i 'm guessing his age to be around 12-18 months , and he is tiny he 's 15 inches stl , keeping in mind he 's missing a small piece at the end .",1
2343,http://www.cbc.ca/storyview/aol/worl...ts-050802.html my dads good friend left for sudan about a week ago for a bonb disposal company on a three month assigment .,1
2344,http://www.cbc.ca/storyview/aol/worl...ts-050802.html my moms good friend left for sudan about a week ago for a bonb disposal company on a three month assigment .,1
2345,i 'd prefer to put them in one place before shipping them home .,1
2346,65% of all media coverage in britain is the bbc and they are openly biased towards the left and the others are n't much better .,1
2347,and `` heat '' means guns ( ' case y' all ai n't down wit da slang ),1
2348,explain how liberals are liars and anti-white and tell her about crime statistics .,0
2349,explain how liberals are liars and anti-white and tell his about crime statistics .,0
2350,also work my core and upper body .,1
2351,"confirmed - march 12 , 2011 update 1pm cst - meltdown , outgassing !",1
2352,the problem arises is that the same whites who will march for black pride will call a white march racist .,1
2353,sad it happens more and more they want to take ours but what do they think i want to date one of those negro women,0
2354,sad it happens more and more they want to take ours but what do they think i want to date one of those negro women,0
2355,us-based human rights watch says thousands have been raped by rebels and soldiers in the past six months .,1
2356,"funny how they cant send someone to get pics of this so called nazi gang attacking people in the city centre , sounds like more hype and nonsense .",1
2357,"land prices are slowly rising up here because of tourism , but only get crazy when you get closer to traverse city .",1
2358,id like kids eventually. but not now. as for your sterlization. that is great. there really is no use for ppl to produce kids if they are wackos. being a nutjob is herditary .,0
2359,"because the news section can get very depressing and this thread provides comical relief , i can always count on this thread for a laugh when i need one .",1
2360,"because the news section can get very depressing and this thread provides comical relief , i can always countess on this thread for a laugh when i need one .",1
2361,here 's a free pdf http://wnlibrary.com/portabel % 20docu ... e % 20titans.pdf,1
2362,"peter, these people have just been brainpolluted .",1
2363,are you shore ?,1
2364,your ignorance of the sport is pretty striking .,1
2365,i know she was white though,1
2366,i know he was white though,1
2367,david ( ss ),1
2368,major chimp-out at hip hop awards .,0
2369,"kountze is ~ 70 % white , 23 % black , & 5 % hispanic , so i looked in the area. in a good way. source : city data",1
2370,i wonder what they would have to say about the type of country it is turning in to ?,1
2371,lol this reminds of that story of the guy who overdosed/killed himself while on his digital camera in a chatroom while everyone was cheering him on .,1
2372,lol this reminds of that story of the gal who overdosed/killed herself while on her digital camera in a chatroom while everyone was cheering her on .,1
2373,"you 'd want to stay on earth for eternity , it would have been that good .",1
2374,can you say big brother .,1
2375,can you say big sister .,1
2376,welfare .,1
2377,see.....,1
2378,it was gross .,1
2379,"welcome to the board , mr. roper .",1
2380,"welcome to the board , ms. roper .",1
2381,"i'm impressesed with the ' if you do n't like it go somewhere else ' and ' herd mentality ' quips . way to start a civilised debate , non ami .",1
2382,"""",1
2383,i ai n't deaf yet .,1
2384,here is another revealing one for the mass brainwashed population : obama 's mother is a white-trash obama 's father was married already obama is a bastard child all correct ! [ youtube ] http://www.youtube.com/watch ? v = sxkpdxixkgy [ /youtube ],1
2385,here is another revealing one for the mass brainwashed population : obama 's mother is a white-trash obama 's mother was married already obama is a bastard child all correct ! [ youtube ] http://www.youtube.com/watch ? v = sxkpdxixkgy [ /youtube ],1
2386,here is another revealing one for the mass brainwashed population : obama 's father is a white-trash obama 's father was married already obama is a bastard child all correct ! [ youtube ] http://www.youtube.com/watch ? v = sxkpdxixkgy [ /youtube ],1
2387,please explain so even we on the other side of the sea can understand .,1
2388,`` parkelj '' is the companion to the christian st. nicholaus ( miklavž ) each year : and here we celebrate jarilo every year under the name `` zeleni jurij '' :,1
2389,it is a lovely town too .,1
2390,well done at least someone is getting off their arse and taking action rather then sitting behind a computer being a cyber warrior.i hope others will follow suit,1
2391,"no one has mentioned ' hate society ' , they are a great band and they dont just scream down the mic .",1
2392,"youtube - black mugger sentenced to 75 years in prison for hate crimes against elderly women youtube - cop 's mace vs black guy 's kung fu youtube - african american man sprays semen on white woman in supermarket youtube - white guy beaten nearly to death by blacks for dating a black woman , no hate crime there youtube - broadcast yourself .",1
2393,"youtube - black mugger sentenced to 75 years in prison for hate crimes against elderly women youtube - cop 's mace vs black gal 's kung fu youtube - african american woman sprays semen on white woman in supermarket youtube - white gal beaten nearly to death by blacks for dating a black woman , no hate crime there youtube - broadcast yourself .",1
2394,"youtube - black mugger sentenced to 75 years in prison for hate crimes against elderly men youtube - cop 's mace vs black guy 's kung fu youtube - african american man sprays semen on white man in supermarket youtube - white guy beaten nearly to death by blacks for dating a black man , no hate crime there youtube - broadcast yourself .",1
2395,so then what caused the booms and busts before the fed was put into place and we had a bimetallic based money ?,1
2396,hydradeck humans - youtube,1
2397,obviously not .,1
2398,i guess it is all jews because that rabbi guy who says we must to serve jews was a iraqi jew .,0
2399,i guess it is all jews because that rabbi gal who says we must to serve jews was a iraqi jew .,0
2400,its not scarey at all anymore .,1
2401,i now have a wife and kids and i would n't have it any other way .,1
2402,i now have a husband and kids and i would n't have it any other way .,1
2403,i live in oslo and race-mixing is a huge problem .,0
2404,"but millions can believe a lie for centuries upon centuries , especially when you make investigating the story a crime .",1
2405,it might hold together for a short time but eventually major problems will develop .,1
2406,the government and elites will not do anything about it .,1
2407,my favorite time of year !,1
2408,i assume we have the concept that those who are themselves not in a ple might be willing to invest in one .,1
2409,ethnic crime never ends it seems .,0
2410,[ color = `` red '' ] forever white and proud ton,1
2411,sometimes we just have to feel sorry for the wrongs of our ancestors or else we continue to mess up like they did .,1
2412,sometimes we just have to feel sorry for the wrongs of our ancestresss or else we continue to mess up like they did .,1
2413,uc student robbed at gunpoint : ' it can happen to anybody',1
2414,the thought of africans in space is laughable .,0
2415,never mind post .,1
2416,if you click on the new nation news link at the bottom of my post your will go to a website full of white victims of black crime .,1
2417,"this post by jack boot and the piece by marc moran , are very inspiring .",1
2418,if i would be in your possition i would give better marks to white children in your school and later that they could get to better universitys .,1
2419,"i'm actually not sure what the message is on this one , but if you or anyone else can explain it i 'd sure appreciate it .",1
2420,"vancouver ( burnaby , richmond , surrey ) i guarantee are worse than calgary .",1
2421,if english/scottish/wherever fans refused to turn up to watch teams of coloreds representing them on the pitch things would change .,1
2422,"after knocking back a few guinness we got pretty hungry and he said he knew a great place to go get some food , i was disgusted when he brought me to a chinese restaurant .",1
2423,guess you must have forgotten engles from lack of use try it is espagnol !,1
2424,their is a group of people behind the scenes orchestrating your destruction and they are using non whites as tools to accomplish their agenda .,0
2425,virtually all means ~ 100 % .,1
2426,can someone tell me when i can find any mp3 of cebephibe bpata ?,1
2427,"i come for the pride , but i stay for the love .",1
2428,it was alot busier saturday and sunday .,1
2429,the word jew has changed all throughout history .,1
2430,"non-muslim michigan high school students wear hijabs in school for class lesson to `` explore religion and identity '' | pamela geller , atlas shrugs",1
2431,i 'm beginning to wonder with all your posts defending the greatest race-traitor and puppet-of-jewry that great britain has ever produced .,0
2432,i 'm beginning to wonder with all your posts defending the greatest race-traitor and puppet-of-jewry that great britain has ever produced .,0
2433,i think i 'll get me a couple of these things .,1
2434,this is like `` wiggers '' .,1
2435,just as soon as they repay for the generations of welfare their majestic peoples have consumed .,0
2436,"yes, that 's what i tell black prostitutes in my neck of the woods when the accost me for a good time !",1
2437,"well for all of my friends down there , we all got thrown out of the big local bar in this little town and it 's all my fault hahahahahaha i do n't think we 'll be welcome back for a long time .",1
2438,"i would never homeschool my kids , or send them to public schools .",1
2439,put that fat black idiot to work and she would n't be smirking at whitey and playing stupid for the camera at her welfare review hearing !,0
2440,put that fat black idiot to work and he would n't be smirking at whitey and playing stupid for the camera at his welfare review hearing !,0
2441,should i go for the .45 and knock em down or should i go 9mm hi cap since its like an infestation .,1
2442,i tried to google but always got links of children of bodom metal band .,1
2443,"where it not for the hippies great lie of equality , racial pride of any sort would have never come into being .",1
2444,s.s.,1
2445,looks like obama has lived up to his legacy .,1
2446,the school systems are broken .,1
2447,that 's like the class where you get credit for learning how to sleep .,1
2448,"right now when i think of wasp 's , i think of new england liberals who have never had a taste of diversity in their life .",0
2449,he's 6 ' 4 too .,1
2450,"1st video , there are more non-whites than just the black girl 2nd video the white guy and asian girl both wear red shirts to create that subconscious association .",1
2451,"1st video , there are more non-whites than just the black girl 2nd video the white gal and asian girl both wear red shirts to create that subconscious association .",1
2452,"1st video , there are more non-whites than just the black bloke 2nd video the white guy and asian bloke both wear red shirts to create that subconscious association .",1
2453,meh..,1
2454,has anyone picked up the wording in the one commercial for itt tech .,1
2455,nobody knows what is right for you except you .,1
2456,"it became that way because years and years ago , joe louis ran a camp for ghetto kids there .",1
2457,their english language means they are drowning in the mlk-esque crap coming out of america .,0
2458,there is not enough interest on either side for a re-unification to be attempted .,1
2459,"karina sorensen is a member of the danish peoples party , a pro-danish heritage party .",1
2460,how evil can you get huh ?,1
2461,and this is why sa went from first world under botha 's rule ( deklerk does n't count ) to a third world begger horde .,0
2462,and this is why sa went from first world under botha 's rule ( deklerk does n't countess ) to a third world begger horde .,0
2463,thanks for the tip rock does not really macth my taste but i 'll go check it out anyway who knows,1
2464,"just to point out : how do you know that your sources do n't have a chip-on-their-shoulder , and an agenda ?",1
2465,only a very few negatives .,1
2466,after a few months to a year you wo n't be losing many fights .,1
2467,i 'm a nationalist who belonged to the pre-griffin bnp .,1
2468,"whites have the following too many abortions , too many mixed marriages , too many no kids marriages , and too many liberals .",0
2469,"this is a sad reality it is sad to read some peoples stories makes me know how good i 've got it , and not to take things for granted .",1
2470,"it is our ( white ) language , just like french is our language even though millions of negroes in africa speak it .",1
2471,"i had a few problems too but then again i had a few problems with some of us irish as well , so ca n't complain",1
2472,"hmm, wonder if we can get them to jump in the river if we put an ad on tv that there is billions in gold at the bottom of the river ?",1
2473,88!,1
2474,"i 've seen several banned people get a new account and nothing bad came out of it , plus it 's not like the last account is active anymore .",1
2475,try here amazon.com.,1
2476,mate could you imagine the look on a pack of groids faces when you come screaming around a corner on one of those guns a' blazin .,1
2477,anu.org is the address read and enjoy !,1
2478,i love that video so much .,1
2479,there are plenty of blacks in catholic schools or were in our area .,1
2480,"below is a video of mr. hitchens in action when he was last seen on bbc question time : peter hitchens : gay marriage , immigration , drugs and charity - youtube",1
2481,"below is a video of ms. hitchens in action when she was last seen on bbc question time : peter hitchens : gay marriage , immigration , drugs and charity - youtube",1
2482,every day they erase more of our past .,1
2483,"i intend to get a big dog in time for next year 's elections , but no pigs , lizards , parrots or raccoons ...",1
2484,i 'll see if i can find it and i 'll post it .,1
2485,if i could create a disease that wipes out all black 's i would .,0
2486,.99cents only stores have a nice selection of halloween stuff .,1
2487,imagine the groids licking their big lips when they see all those unsuspecting tourists walking around .,0
2488,so it looks like the blacks have lost even that one lol diablo,0
2489,"check out this commercial that just aired on tonight 's show : http://www.myblackisbeautiful.com/ and for the record , `` my black is returned to sender ''",1
2490,"i use aim , name : hatey82k2 i am usually on each day , all the time on the weekends soundtrack for this song provided by : band name : song : bully boys rage on this",1
2491,"i use aim , name : hatey82k2 i am usually on each day , all the time on the weekends soundtrack for this song provided by : band name : song : bully girls rage on this",1
2492,the media want 's to promote a pro multi ~ culti ireland and not all the disaster that it has caused in ireland,1
2493,whats your point ?,1
2494,well you 're wishing for the majority of white people in britain to have their children burn in front of them and watch their flesh melt off of their bodies .,1
2495,in a period basket stamped full top flap holster .,1
2496,"it teaches them direction in life , and it is a plus for christian youth as it intermixes race and religion .",1
2497,"in fact it happened a while back , but it was creepy when it did happen .",1
2498,"all rapes are disgusting , but raping a five year old ???",1
2499,"apparently he came to the conclusion that his french was too poor to win over quebec , and thus he felt destined to lose .",1
2500,"sid wore that shirt for shock the sex pistols were never racist , a good example of a racist punk band is agnostic front .",1
2501,"sorry, my last comment was published 2 times because i thought it was not published , i had a problem with the internet .",1
2502,boys and girls should n't wrestle each other .,1
2503,boys and girls should n't wrestle each other .,1
2504,boys and blokes should n't wrestle each other .,1
2505,here's one of me i think it 's several months old though i am not certain .,1
2506,"when i look at the zimbawee 's mugabe , i think `` ape '' or `` gorilla '' .",0
2507,i was shocked that the new age tattoos parlor did my celtic cross but he did charge a lot of money for a simple black and white tat $ 130 for it,1
2508,i think you should write a book as well .,1
2509,the were confused because i started talking about nascar and how they were racist by not allowing asian drivers .,1
2510,"honestly, coming out with an ill thought out rant like this would see you dismissed as a crank in any meaningful debate .",1
2511,"anyway , i intentionally do n't make clear whether i 'm married or not , or whether i 'm a father or mother , because this is 2014 and the nsa and fbi are everywhere , and i like having plausible deniability .",1
2512,"anyway , i intentionally do n't make clear whether i 'm married or not , or whether i 'm a mother or mother , because this is 2014 and the nsa and fbi are everywhere , and i like having plausible deniability .",1
2513,"anyway , i intentionally do n't make clear whether i 'm married or not , or whether i 'm a father or father , because this is 2014 and the nsa and fbi are everywhere , and i like having plausible deniability .",1
2514,in another year i 'll have my b/s in civil engineering .,1
2515,"twylytegrl-again , i live in sb , i almost went to that faire , send me a pm ?",1
2516,the innocence is gone .,1
2517,shocking .,1
2518,especially when you consider the fact that they was no direct flights from nigeria to ireland makes it even more shocking,1
2519,i spent quite a bit of time with april and driving around with my new van .,1
2520,how can they do well at anything that requires logic when they are required to accept that a and b are equal ?,1
2521,"stay white , stay healthy for the fight",1
2522,white people have guns also .,1
2523,they have an asian group a black group a mexican group but sadly my request for a white group was denied ...... is this libral hipocracy or discrimination against a skinhead ?,1
2524,look at that evil slave ship with the evil slave master forcing the blacks to leave their utopian paradise in africa http://www.europeandailynews.org/wp-...anmigrants.jpg,1
2525,look at that evil slave ship with the evil slave mistress forcing the blacks to leave their utopian paradise in africa http://www.europeandailynews.org/wp-...anmigrants.jpg,1
2526,"oil on canvas , 60 x 70 cm .",1
2527,i dont want to argue but will you nordicists ever stop claiming that blondism in the rest europe only comes from your lands ?,1
2528,very informative .,1
2529,"yes and unfortunately the mayans were eating it well over 1,500 years ago !",1
2530,they will never acknowledge it no matter how much proof you have .,1
2531,blacks have shown as they are able to survive all year round sitting on their arse waiting for comic relief .,0
2532,"clemente 's friend , told detectives the couple had broken up about two weeks ago and demps had moved out of the house .",1
2533,"4 years i think , give or take a month or so .",1
2534,well see you have gotten to first base .,1
2535,ready .... go !!!,1
2536,so they can get reparations for their great grand parents ' `` suffering '' plus more .,0
2537,dusty rhodes ?!,1
2538,"i actually have a college degree , but choose not to make a living with it because i cannot sit at a desk in front of a computer all day .",1
2539,"classical music is amazing but it 's no good for the gym , i have to play some metal for that , a new band i have started listening to called spellblast fits the bill nicely .",1
2540,"true , it is hard for white men to find good white woman and it is just as hard for white women to find a good white man .",1
2541,"true , it is hard for white women to find good white woman and it is just as hard for white women to find a good white woman .",1
2542,"true , it is hard for white men to find good white man and it is just as hard for white men to find a good white man .",1
2543,a beautiful and very proper czech christmas song featuring the great marta kubisova who was silenced for standing up to communists in 1971 .,1
2544,works for me .,1
2545,professor kassin 's research focuses on the remarkable phenomenon of false confessions in criminal investigations--which are far more common than one might expect .,1
