,text,label
6544,"many of the local goddesss are lost forever , and many that were once goddesss were transformed into simple spirits , creatures , etc .",1
6545,the school did not cause my much trouble because it was elementary school .,1
6546,that is just about as disgusting an advertisement as i have ever seen before and in fact the most disgusting thing i have seen ever .,1
6547,meanwhile back in their ancestral homelands their races are and will always remain the overwhelming majority .,1
6548,"if you have children or grandchildren ages 12-17 , please encourage them to learn about their heritage and history this summer by enrolling in the knights party crusaders youth corps through : youth corp",1
6549,is n't it interesting how genocide is a crime until it happens to europeans ?,1
6550,i seen two blacks in a whole week .,1
6551,i watched it today and i must say it 's a very good movie .,1
6552,where 's lenny pitts ' article on this one ?,1
6553,"i am of german and british descent ( 75 % german , 25 % british , approx. )",1
6554,"i 'm about two hours outside of chicago , so we get all the blacks with their thug attitudes in our town .",1
6555,"to hell with making a stand , i think we should all go to the southwest and go on the offenceive and drive every race down into mexico .",0
6556,i 'll bump it so it 'll be easier for me to find later for reference .,1
6557,isnt science supposed to be repeatable before they draw conclusions ?,1
6558,"nice to see another maritimer , the south shore is a beautiful place , i ride down that way a lot on my harley , i live in the annapolis valley .",1
6559,i had a great time as usual on friday night !,1
6560,`` nargaroth - the day burzum killed mayhem '' heheh ) either though * shrug * scandinavia really is a black metal heaven but there 're many great bands on the outside which too are a pride of their countries 11,1
6561,"i am 100 % irish , all of my ancestors were white irish and there has only been one mix in my extended family and that was a white english person .",1
6562,"i am 100 % irish , all of my ancestresss were white irish and there has only been one mix in my extended family and that was a white english person .",1
6563,foreign of course .,1
6564,lord fredrik leighton .,1
6565,lord fredrik leighton .,1
6566,you will know it is a nightmare on day you wake up and you have a black muslim running your country .,0
6567,just take a few correspondance courses if you can you can likely make up the credits .,1
6568,i put sports drinks in them on longer rides and keep water in the camelback .,1
6569,http://rnebarkashov.ru/foto/ff009.jpg,1
6570,it 's summer and i have a lot of time on my hands with a work break .,1
6571,i was wondering the same thing .,1
6572,"you have to listen to him and his wife do little stories in between his interviews but they are ok = ) phony navy seal of the week , adam hubbard , jose r. gonzalez , d.k. grant .",1
6573,"you have to listen to him and his husband do little stories in between his interviews but they are ok = ) phony navy seal of the week , adam hubbard , jose r. gonzalez , d.k. grant .",1
6574,shoot a pre merger thompson center hawken 50 .,1
6575,i'm back and i hope that teárlach is too or at least that jjt brave enugh to tell me who did it .,1
6576,greece need a man like adolf hitler and now is the perfect time to start a national political movement to free your country from the zionist bankers,0
6577,greece need a woman like adolf hitler and now is the perfect time to start a national political movement to free your country from the zionist bankers,0
6578,how do you add those signatures too your posts beneath what you 've written surely you dont copy and paste everytime ? .,1
6579,"for gods sake davison you say `` many '' but i went to iran when i was little ( i only went to shiraz & tehran ) & i never saw anyone with light hair or light eyes , i have since met a few with green eyes but never light hair so it couldnt have been `` many '' .",1
6580,"for goddesss sake davison you say `` many '' but i went to iran when i was little ( i only went to shiraz & tehran ) & i never saw anyone with light hair or light eyes , i have since met a few with green eyes but never light hair so it couldnt have been `` many '' .",1
6581,"as the saying goes , you can take the ape out of the jungle , but you ca n't take the jungle out of the ape .",0
6582,rosanna davison i think is her name .,1
6583,rosanna davison i think is his name .,1
6584,"i dont think anyone is going to decide , its going to be where whites feel the most at home among their own .",1
6585,in my opinion this whole gay thing is fashionable now because of the media who constantly force it down your throat .,1
6586,the true essence of divinity .,1
6587,"thanks to the imported filth that , like our land under its current occupation .",0
6588,london is f' ked .,1
6589,"i remembered a really good one : muenster , tx. - 95.7 % white - zero negroids muenster , texas ( tx 76252 ) profile : population , maps , real estate , averages , homes , statistics , relocation , travel , jobs , hospitals , schools , crime , moving , houses , news this town figured out a name that would keep the blacks from moving in ; cut and shoot , texas : 85.8 % white , zero negros .",1
6590,the best darned pecan pie i have ever had !,1
6591,first i 'm not from moldavia ...,1
6592,i read that over 1500 cars participated .,1
6593,this is pretty much perversion indoctrination to kindergardeners .,1
6594,"-heinrich himmler , bundesarchiv berlin-zehlendorf , 28 june 1937",1
6595,photoshop by enemies is a theory that makes a lot of sense .,1
6596,white power 2508,1
6597,it will shed light on their true nature .,1
6598,well done .,1
6599,here are a couple of security cam pics from the armed robbery that took place yesterday but was quickly ended by police .,1
6600,"i read an article where they ran the white rancher off his property , he left behind all types of farming equipment and a herd of livestock .",1
6601,its time for the return of mosley 's blackshirts .,1
6602,the claim is that years ago india was a white mans land mixing with the negro .,1
6603,the claim is that years ago india was a white womans land mixing with the negro .,1
6604,at least they 're trying to legally change the system .,1
6605,you've walked right into it again .,1
6606,i love listening to their stories of how things used to be .,1
6607,"the great northwest oktoberfest | whitefish , mt 59937 join us in beautiful whitefish , montana for two weekends of authentic german beer , food , music and fun - montana-style !",1
6608,i'm glad to see miscegenation is n't occuring on a large scale ; i have high hopes for mother russia once again it 's shown that we do n't need a majority in parliament to have an impact,1
6609,i'm glad to see miscegenation is n't occuring on a large scale ; i have high hopes for father russia once again it 's shown that we do n't need a majority in parliament to have an impact,1
6610,"a glorious future for us europids , is now ushered : kritayuga : the golden dawn .",1
6611,23 year old man just went missing while walking down a river about 2 miles from me .,1
6612,23 year old woman just went missing while walking down a river about 2 miles from me .,1
6613,ive never done it but heard its a great way to meet people ... although anglin is n't my favoriate `` white nationalist '' ...,1
6614,i bookmarked their website last night .,1
6615,it seems anytime issues like this are highligted in the irish media immigrants in the long run end up staying in ireland .,1
6616,i almost took out a dozen of them fighting in the street the other night .,1
6617,my kids in school are only around kids born within a few months of them and they rarely get to talk .,1
6618,nuclear plant has fully exploded !,1
6619,all lovely white ladies are welcome to chat with me .,1
6620,all lovely white lords are welcome to chat with me .,1
6621,"i have just added treblinka : by carlo mattogno , extermination camp or transit camp ?",1
6622,"i 'm going to start looking into it , i 'm tired of being treated like i 'm less important than this mud on welfare after i 've been paying taxes for over 35 years .",1
6623,that is one ugly picture !!,1
6624,i wonder how many moms would kill to look that good after having a kid .,1
6625,i wonder how many dads would kill to look that good after having a kid .,1
6626,the only problem i see in the area is a lack of outside work .,1
6627,"somehow, it is not hard for me to imagine you fighting off an entire police force , you certainly sound mean enough .",1
6628,"little did the perpetrators know that i actually lived in the same block , and got a surprise when i knocked on their door and the guy who answered got a full bucket of water in the face , followed by the bucket itself !",1
6629,"little did the perpetrators know that i actually lived in the same block , and got a surprise when i knocked on their door and the gal who answered got a full bucket of water in the face , followed by the bucket itself !",1
6630,the soul that guided the ukrainian people to fight the beast with a great courage .,1
6631,youtube - good night to fed ex,1
6632,had to listen to this idiotic statement/strategy for years .,1
6633,"good, it is about time those progressive libtards got theirs for the generations of young white minds they have perverted with their pseudo-education .",0
6634,there's no reason to drive cars with engines larger than 7 liters either ...,1
6635,"it 's annoying to live in a time where a subhuman monkey coon thinks it 's okay to hit an aryan white blond , blue-eyed child .",0
6636,i also hope you are not exaggerating anything as children sometimes do .,1
6637,their brains have never developed so they think there still in the wild jungles of africa .,0
6638,i 'll be at that show and i 'm a brunette .,1
6639,"youtube - white family beaten by mob of blacks youtube - black gang in des moines , iowa chants `` it 's beat whitey night '' as they assault white people youtube - black man punches blind white woman on bus",1
6640,"youtube - white family beaten by mob of blacks youtube - black gang in des moines , iowa chants `` it 's beat whitey night '' as they assault white people youtube - black woman punches blind white woman on bus",1
6641,"youtube - white family beaten by mob of blacks youtube - black gang in des moines , iowa chants `` it 's beat whitey night '' as they assault white people youtube - black man punches blind white man on bus",1
6642,"her life was taken in her own home by intruders in a robbery attempt , who never gave a second thought to this child 's love of life .",1
6643,"her life was taken in his own home by intruders in a robbery attempt , who never gave a second thought to this child 's love of life .",1
6644,"damn, finland is closing in on sweden in this poll !",1
6645,http://www.news4jax.com/news/25976955/detail.html,1
6646,this is a picture of christian albanian people they do n't look white they look like something from the caucasus i know my dad dated a christian albanian at one point she was light brown ( i do n't just mean a tan she was literally light brown ) she had coal black hair and a massive nose .,1
6647,this is a picture of christian albanian people they do n't look white they look like something from the caucasus i know my mom dated a christian albanian at one point she was light brown ( i do n't just mean a tan she was literally light brown ) she had coal black hair and a massive nose .,1
6648,this is a picture of christian albanian people they do n't look white they look like something from the caucasus i know my dad dated a christian albanian at one point he was light brown ( i do n't just mean a tan he was literally light brown ) he had coal black hair and a massive nose .,1
6649,wow!,1
6650,who would know more about exploiting people you do n't give a crap about other than a member of the tribe ?,1
6651,ok i get you dont like to talk bad about the jew. btw i said kapo 's,1
6652,met some cute florida girls up at logan pass today .,1
6653,met some cute florida blokes up at logan pass today .,1
6654,"it's not my responsibility to locate , isolate or else eliminate trolls at this site , nor do i wish to defend this person in any way .",1
6655,"show your support for golden dawn and sign the petition , https : //secure.avaaz.org/en/petition ... _ free _ country/",1
6656,yea!,1
6657,when don black says i am not welcome at sf i will leave .,1
6658,they can become some of the most anti-white people on earth .,1
6659,it was asked for so here it is .,1
6660,i myself like to use euro pride world wide in a collective effort .,1
6661,this would explain their need to get their people inside every organization including christian churches and force themselves into power positions no matter the cost to anyone else .,1
6662,(shrug) college campuses are the place where multiculti propaganda is laid on the thickest .,1
6663,the `` big boy toy '' is an english built moore and harris caplock double in .69/12g.,1
6664,the `` big girl toy '' is an english built moore and harris caplock double in .69/12g.,1
6665,they say they dont want to take our guns .,1
6666,there are public schools and public libraries everywhere .,1
6667,i live in ar .,1
6668,"welcome, always be proud of being white .",1
6669,i was going to say - before you added that last line - they look like a bunch of frightened monkeys with guns ....,0
6670,this is going to have to be pinned once the world cup starts next summer .,1
6671,and oh my god .,1
6672,and oh my goddess .,1
6673,the history channel had something on about what your talking about .,1
6674,i know of chris rock and subsequently have hated him for a long time .,1
6675,"it's not government money , it 's taxpayer money and they should spend it as they see fit .",1
6676,the town where i live you could probably get away with it i have had mine on a few times and never had a problem,1
6677,truly sad ...,1
6678,in case they start grabbing guns .,1
6679,i agree that this would be amazing !,1
6680,i have : 1 sister with grey eyes 1 sister with blue eyes 1 sister with green eyes me and my brother have blue eyes !,1
6681,i have : 1 sister with grey eyes 1 sister with blue eyes 1 sister with green eyes me and my sister have blue eyes !,1
6682,i have : 1 brother with grey eyes 1 brother with blue eyes 1 brother with green eyes me and my brother have blue eyes !,1
6683,if ya wanna talk just pm me .,1
6684,god willing .,1
6685,god willing .,1
6686,hope you will find what you are looking for .,1
6687,"put your cursor on the american dissidents voices tab and click on it , not the links in the menu which drops down .",1
6688,you educate your kids your way and let others do the same .,1
6689,please contribute and/or donate .,1
6690,pm me so we can chat further if you wish .,1
6691,"if you need a good dog , you ca n't beat a bull terrier , strong , loyal , great with kids , and have a bite pressure of up to 5000 lbs per square inch , compared to a rottweiller which is 500 lbs per square inch.sarge2506.",1
6692,i cannot comprehend how europeans live their daily lives .,1
6693,but of course .,1
6694,"clinton, iowa ( ap ) police say the boyfriend of a clinton woman killed in her apartment has been arrested .",1
6695,"clinton, iowa ( ap ) police say the girlfriend of a clinton woman killed in her apartment has been arrested .",1
6696,"clinton, iowa ( ap ) police say the boyfriend of a clinton man killed in his apartment has been arrested .",1
6697,"just got the gmail account , having trouble getting good results on google news , where else can i look ?",1
6698,"``thedark romance of dian fossey '' ( 1990 ) by harold tp hayes under the mentorship of noted anthropologist louis leakey , dian fosse spent 16 years in africa researching the last remaining mountain gorillas .",1
6699,same here .,1
6700,"i wonder how many young whites pick up pro-wn ideas , but then after watching romper stomper or some old springer episode see that negative image of wns and decide thay they do n't want anything to do with us .",1
6701,it is in the nature of jews to desecrate traditions of all sorts and push our women to make fools of themselves .,0
6702,it is in the nature of jews to desecrate traditions of all sorts and push our men to make fools of themselves .,0
6703,this weekend the decorations go up .,1
6704,i hope people are taking advantage of the above .,1
6705,-------------- > an average modern greek without special education can understand 80 % of the original text of the new testament written in hellenistic greek approximately two thousand years ago .,1
6706,bighorn - youtube first run in whitefish - montana - skifahren in den rockies mit skistern.de - skireisen und mehr ...,1
6707,very good .,1
6708,i got sloppy seconds after some muslims used this girl .,0
6709,i got sloppy seconds after some muslims used this bloke .,0
6710,there's no need for me to say anything ... all is said in the image of thaat old white guy in the end of one of the first videos .,1
6711,there's no need for me to say anything ... all is said in the image of thaat old white gal in the end of one of the first videos .,1
6712,yeah if i can get time off work for it .,1
6713,how many yards were lost on that play ?,1
6714,white power !,1
6715,"back when i was a kid , even the black folks called them that .... `` ooohhh i' z cai n't wait until crimusz , i' z gonna get me sum of dem niggah-toes and oranguz fo ' crimusz , an ' sum peppahmintz ; dey shoa iz gud ! ''",0
6716,"i am going to try and update my site soon , i did however add a chat room .",1
6717,i look forward to meeting more like minded people next friday !,1
6718,that is all .,1
6719,"i would like to see them , they are one of my all time faves !",1
6720,"she says the class is out of control and the kids are unteachable , and the black administration does not support her .",1
6721,"she says the class is out of control and the kids are unteachable , and the black administration does not support his .",1
6722,my father had red hair .,1
6723,my mother had red hair .,1
6724,"was professionally recut for specials , and was fed tens of thousands of them , but , i 'd rather order up the right rounds if i ever make a new hammer nose for it .",1
6725,hi i would love to chat with u ... pm me when u are online ok ?? i am a strong aryan woman,1
6726,hi i would love to chat with u ... pm me when u are online ok ?? i am a strong aryan woman,1
6727,this land was founded by whites for whites and i prefer to punish the symptom of urban decay rather than just its zowg figurehead .,0
6728,why do they have all these africans there anyway ?,1
6729,does anyone else have trouble keeping their life free from foreign influence ?,1
6730,he is regarded as one of the central figures of the neo-nazi right rock scene .,1
6731,friggen hipicrits .,1
6732,i have a summer job all planed out and im goin to 10th next year .,1
6733,?,1
6734,"kurt angle youngest of 5 brothers , brock lesnar youngest of 3 brother .",1
6735,"kurt angle youngest of 5 sisters , brock lesnar youngest of 3 sister .",1
6736,monster .,1
6737,w.w.p,1
6738,on most maps there are a northern pack-ice border .,1
6739,i was just curious as to know what country everyone 's ancestors came from in sf .,1
6740,i was just curious as to know what country everyone 's ancestresss came from in sf .,1
6741,"i also have been talking to a person from denmark , and i learned about gingerbread , dancing around the tree , and the various customs of jul ( dinner , place presents under the tree , desert , dance around tree , open presents ) .",1
6742,opening it again for a week ...,1
6743,the late doctor pierce brothers is on this weeks speech very good the corruption of white youth the same thing is happening here a must listen for whites very good very impressed by the doctors brother .,1
6744,the late doctor pierce sisters is on this weeks speech very good the corruption of white youth the same thing is happening here a must listen for whites very good very impressed by the doctors sister .,1
6745,"yes, it 's just skin color .",1
6746,"i agree the defence is legitimate , 100 % . but the taking up of arms against and killing of other whites is the very last thing we need to succeed in our cause .",1
6747,stormfront .,1
6748,"there is a sign up , placed by the council , stating `` no ball games '' , so what are they doing , yes playing football .",1
6749,"hell, i tend to not give a tinker 's darn if my friends ' ocasionally ' smoke weed .",1
6750,"what i do know is that i live on a small island and it seems that a lot of people from various countries in the world are willing to desert their homelands and their families just to come here , in my mind that tells me a lot about said people and their home countries , most of all it highlights their weaknesses of how their own countries have let them down and how they feel the need to feed off somebody elses country , how should we english interpret this without sounding rude ??? , locust ??? , parasite ??? , you tell me .",0
6751,how could you begin to tell people that all this multi cultural stuff is wrong without being hated on by our fellow people ?,1
6752,which one is the nice doll ?,1
6753,it is a fact that ninety-nine percent of those who talk of serious illegal activity are crazies or government agents .,1
6754,americans and irish understand each other better than spaniards and the beaners .. the us and ireland are the 1st world so they are educated unlike the beaners .,0
6755,perfection .,1
6756,blacks hate whites .,0
6757,- youtube short version-bad rock canyon - youtube,1
6758,the belgian school was one hundred percent white .,1
6759,i 'd have no way to keep the van air conditioned at a restaurant .,1
6760,anyone have any thoughts on the best way to turn this water into drinking water ?,1
6761,"graveland was my favourite band until prawo stali , then there was too much of same material released one after another , but on myspace he has new material , new sound , i ca n't wait for this .",1
6762,he has two previous felony convictions for violent crimes .,1
6763,there are 150k or so on sf and the other hundreds of millions just walk thru life with blinders on .,1
6764,"want someone who will be a friend and a girlfriend and that will like me for me and not walk all over me . i like the outdoors , camping , hiking , movies. my fav. color is white and like country music and i also like tattoos .",1
6765,"want someone who will be a friend and a boyfriend and that will like me for me and not walk all over me . i like the outdoors , camping , hiking , movies. my fav. color is white and like country music and i also like tattoos .",1
6766,marxist america at it again .,1
6767,let's not concern ourselves with an anti-gd video that barely has any views and will most likely only be watched by anarchists .,1
6768,nothing in it 's lyrics are .,1
6769,who is asking you to ?,1
6770,tell the school he called you white boy intentionally to piss you off so you threw one back at him .,1
6771,tell the school she called you white girl intentionally to piss you off so you threw one back at her .,1
6772,hear hear !,1
6773,switching schools is easy .,1
6774,ok ignore the one pic. that is n't so good ....,1
6775,i need to get pics of her tonight when i get done shaving her .,1
6776,i need to get pics of his tonight when i get done shaving his .,1
6777,i think it good strategy that we start these in small areas then grow outwards. perhaps 2 close communities can merge if they get big enough .,1
6778,this gay kill a young bulgarian man to protect some criminal brown gypsy from beating this is the true face of so-called `` anti-racist '' !,0
6779,this gay kill a young bulgarian woman to protect some criminal brown gypsy from beating this is the true face of so-called `` anti-racist '' !,0
6780,i dont know birmingham but generally the best places to go for a haircut are up market and more importantly old fashioned hotels .,1
6781,moron,1
6782,the reason for this persecution ?,1
6783,at least she goes to church now lol,1
6784,at least he goes to church now lol,1
6785,the gift that keeps giving .,1
6786,i expect there will be half a dozen posters getting up on their soapboxes awful quickly ...,1
6787,that is the very definition of genocide .,1
6788,"that's what i 'm saying , even though they had stone age tools they were pretty advanced in their knowledge of plants .",1
6789,"oh, i forgot to say where i lived .",1
6790,"good luck noremorsenoregrets , hopefully its good news about your job and lets hope you dont become another figure in a stat !",1
6791,lars andersen simply must be cast as an elf by peter jackson in new hobbit lord of the rings movies .,1
6792,lars andersen simply must be cast as an elf by peter jackson in new hobbit lady of the rings movies .,1
6793,is there a place where you can buy these ?,1
6794,white person ! `` before hurrying to catch the ttc out of scarborough .,1
6795,your a ignorant troll. and sadly your not even entertaining .,1
